<?xml version="1.0" encoding="UTF-8"?>
<businessDefinition 
	xmlns = "http://www.processpuzzle.com/"
	xmlns:xsi="http://www.w3.org/2001/XMLSchema-instance"
	xsi:schemaLocation="http://www.processpuzzle.com/ ../../business/definition/domain/BusinessDefinition.xsd ">

	<!-- PartyTypes: Defines acceptable types of parties. -->
	<partyTypes>
	</partyTypes>
	
	<!-- PartyRoleTypes: Defines the roles can be filled in the workflows. -->
	<partyRoleTypes>
	</partyRoleTypes>
	
	<partyRelationshipTypes>
	</partyRelationshipTypes>
	
	<artifactTypes>
		<artifactTypeGroup name="SystemAdministration">
			<defaultAccessRights>
				<accessRight partyRoleType="Coach" canCreate="true" canDelete="true" canModify="true" canRead="true" />
				<accessRight partyRoleType="XPTeamMember" canCreate="true" canDelete="false" canModify="true" canRead="true" />
			</defaultAccessRights>
		
			<artifactType name="RootArtifactFolder" artifactClassName="com.processpuzzle.artifact.domain.RootArtifactFolder" createOnStartUp="false" group="SystemAdministration" isSingleton="true" isSystem="true" isVersionControlled="false" pessimisticLock="false" refreshOnDocumentActivation="true" refreshOnViewActivation="true">
				<description>Root of all other artifact folders.</description>
				<caption>Root Folder</caption>
				<baseUri>baseUri</baseUri>
				<defaultAccessRights>
					<accessRight partyRoleType="ProcessPuzzleAdministrator" canCreate="false" canDelete="false" canModify="false" canRead="true" />
				</defaultAccessRights>
				<creationProperties>
					<creationProperty name="aProperty" type="string">
						<value>A property value</value>
					</creationProperty>
				</creationProperties>
				<availableViews>
					<propertyViewType name="PropertyView" clientType="NativeView" isDefault="true" isStatic="false" presentationUri="uri" viewClassName="com.processpuzzle.artifact.domain.RootArtifactFolder_PropertyView">
						<viewCaption>Property View</viewCaption>
						<viewAccessUrl>viewAccessUrl</viewAccessUrl>
						<associatedMenuItems>
						</associatedMenuItems>
					</propertyViewType>
				</availableViews>
				<associatedMenuItems></associatedMenuItems>
			</artifactType>
			
			<artifactType name="ArtifactFolder" artifactClassName="com.processpuzzle.artifact.domain.ArtifactFolder" createOnStartUp="false" group="SystemAdministration" isSingleton="false" isSystem="true" isVersionControlled="false" pessimisticLock="false" refreshOnDocumentActivation="true" refreshOnViewActivation="true">
				<description>Describes a folder of artifacts.</description>
				<caption>Artifact Folder</caption>
				<baseUri>baseUri</baseUri>
				<defaultAccessRights>
					<accessRight partyRoleType="ProcessPuzzleAdministrator" canCreate="false" canDelete="false" canModify="false" canRead="true" />
				</defaultAccessRights>
				<creationProperties>
					<creationProperty name="aProperty" type="string">
						<value>A property value</value>
					</creationProperty>
				</creationProperties>
				<availableViews>
					<propertyViewType name="PropertyView" clientType="NativeView" isDefault="true" isStatic="false" presentationUri="uri" viewClassName="com.processpuzzle.artifact.domain.ArtifactFolder_PropertyView">
						<viewCaption>Property View</viewCaption>
						<viewAccessUrl>viewAccessUrl</viewAccessUrl>
						<associatedMenuItems>
							<menuItem name="Print">
								<command name="PrintFolderProperties" description="" type="CustomCommand" actionStatement="" customPrefix="" />
							</menuItem>
						</associatedMenuItems>
					</propertyViewType>
				</availableViews>
				<associatedMenuItems>
					<menuItem name="Activate">
						<command name="ActivateProductCatalog" description="" type="CustomCommand" actionStatement="" customPrefix="" />
					</menuItem>
				</associatedMenuItems>
			</artifactType>

			<artifactType name="UserList"
				artifactClassName="com.processpuzzle.party.artifact.UserList"
				createOnStartUp="true" group="SystemAdministration" isSingleton="true"
				isSystem="true" isVersionControlled="false" pessimisticLock="false"
				refreshOnDocumentActivation="true" refreshOnViewActivation="true">
				<description></description>
				<caption>userList</caption>
				<baseUri>../../../../</baseUri>
				<defaultAccessRights>
					<accessRight partyRoleType="ProcessPuzzleAdministrator"
						canCreate="false" canDelete="false" canModify="false" canRead="true" />
				</defaultAccessRights>
				<creationProperties>
					<creationProperty name="aProperty" type="string">
						<defaultValue></defaultValue>
					</creationProperty>
				</creationProperties>
				<availableViews>
					<artifactListViewType name="ListView"
						clientType="BrowseView" isDefault="true" isStatic="false"
						presentationUri="/Commons/BusinessImplementation/SystemAdministration/UserList_ListView.jsp"
						viewClassName="com.processpuzzle.party.artifact.UserList_ListView"
						listedArtifactType="com.processpuzzle.party.artifact.UserDataSheet"
						orderBy="name" order="desc">
						<viewCaption>ui.viewCaption.list</viewCaption>
						<viewAccessUrl>./CommandControllerServlet?action=ShowListView&amp;artifactName=UserList&amp;viewName=UserList_ListView</viewAccessUrl>
						<associatedMenuItems>
							<menuItem name="Show">
								<command name="ShowUser" description="" type="CustomCommand" actionStatement="" customPrefix="" />
							</menuItem>
						</associatedMenuItems>
					</artifactListViewType>
					<printViewType 
						name="PrintView" 
						clientType="PrintView" 
						isDefault="false" 
						isStatic="false" 
						presentationUri="uri" 
						xmlToFoXsltPath=""
						viewClassName="com.processpuzzle.party.artifact.UserList_PrintView">
						<viewCaption>ui.viewCaption.print</viewCaption>
						<viewAccessUrl></viewAccessUrl>
						<associatedMenuItems>
							<menuItem name="Print">
								<command name="PrintUsers" description="" type="CustomCommand" actionStatement="" customPrefix="" />
							</menuItem>
						</associatedMenuItems>
					</printViewType>
					<artifactCommentsViewType 
						name="Comments" 
						clientType="EditableHtmlView">
						<viewCaption>ui.viewCaption.comments</viewCaption>
						<viewAccessUrl>./CommandControllerServlet?action=ShowDocumentNotes&amp;artifactName=UserList</viewAccessUrl>
					</artifactCommentsViewType>
				</availableViews>
				<associatedMenuItems>
					<menuItem name="Activate">
						<command name="ActivateProductCatalog" description="" type="CustomCommand" actionStatement="" customPrefix="" />
					</menuItem>
				</associatedMenuItems>
			</artifactType>
	
			<artifactType 
				name="UserDataSheet" 
				group="SystemAdministration" 
				artifactClassName="com.processpuzzle.party.artifact.UserDataSheet" 
				domainClassName="com.processpuzzle.application.security.domain.User"
				createOnStartUp="false" 
				isSingleton="false" 
				isSystem="false" 
				isVersionControlled="false"
				pessimisticLock="false">
				<caption>userDataSheet</caption>
				<baseUri>../../../../</baseUri>
				<creationProperties>
					<creationProperty name="userName" type="string" />
					<creationProperty name="password" type="string" />
				</creationProperties>
				<availableViews>
					<propertyViewType 
						name="Properties" 
						presentationUri="/Commons/BusinessImplementation/SystemAdministration/UserDataSheet_PropertyView.jsp" 
						clientType="PropertyView"
						viewClassName="com.processpuzzle.party.artifact.UserDataSheet_PropertyView">
						<viewCaption>ui.viewCaption.properties</viewCaption>
						<viewAccessUrl>./CommandControllerServlet?action=ShowView&amp;artifactName=UserDataSheet&amp;viewName=UserDataSheet_PropertyView</viewAccessUrl>
					</propertyViewType>
					<artifactCustomFormViewType 
						name="BaseData" 
						clientType="CustomFormView" 
						presentationUri="/Commons/BusinessImplementation/SystemAdministration/UserDataSheet_BaseData.jsp" 
						isDefault="true"
						viewClassName="com.processpuzzle.party.artifact.UserDataSheet_BaseData">
						<viewCaption>ui.viewCaption.baseData</viewCaption>
						<viewAccessUrl>./CommandControllerServlet?action=ShowView&amp;artifactName=UserDataSheet&amp;viewName=UserDataSheet_BaseData</viewAccessUrl>
					</artifactCustomFormViewType>
 					<relatedArtifactsViewType 
 						name="RelatedArtifacts" 
 						clientType="CustomFormView" 
 						presentationUri="/BusinessImplementation/ProjectAdministration/Artifact_RelatedArtifacts.jsp"
						viewClassName="com.processpuzzle.artifact.domain.RelatedArtifactsListView">
						<viewCaption>ui.viewCaption.relatedArtifacts</viewCaption>
						<viewAccessUrl>./CommandControllerServlet?action=ShowView&amp;viewName=RelatedArtifactsListView</viewAccessUrl>
					</relatedArtifactsViewType>
					<artifactCommentsViewType name="Comments" clientType="EditableHtmlView">
						<viewCaption>ui.viewCaption.comments</viewCaption>
						<viewAccessUrl>./CommandControllerServlet?action=ShowDocumentNotes</viewAccessUrl>
					</artifactCommentsViewType>
					<accessRightsViewType 
						name="AccessRights" 
						clientType="CustomFormView" 
						presentationUri="/Commons/BusinessImplementation/ProjectAdministration/Artifact_AccessRights.jsp" 
						viewClassName="com.processpuzzle.artifact.domain.AccessRightsView">
						<viewCaption>ui.viewCaption.accessRights</viewCaption>
						<viewAccessUrl>./CommandControllerServlet?action=ShowView&amp;viewName=AccessRightsView</viewAccessUrl>
					</accessRightsViewType>
				</availableViews>
			</artifactType>

		</artifactTypeGroup>

	</artifactTypes>

</businessDefinition>